{"apiVersion":"guard.partme.ai/v1alpha1","kind":"GuardFacts","analyzer":{"id":"codeguard.native-projection","version":"0.1.0"},"subject":{"id":"repo","snapshotDigest":"sha256:3727adff524e0616022eadd8f4af21a0778b29fc4c77bdfefd1afce2cbf5e4b7"},"completeness":"partial","facts":[{"subject":"python","predicate":"has","object":"unused-import","source":"scope:ruff_f401_scope_incomplete"}],"diagnostics":["frozen configuration mismatch","per-file ignores unsupported"]}