{"apiVersion":"guard.partme.ai/v1alpha1","kind":"GuardFacts","analyzer":{"id":"testguard-local-evidence","version":"testguard.engine-map/v1"},"subject":{"id":"fixture:repo","snapshotDigest":"sha256:bbbbbbbbbbbbbbbbbbbbbbbbbbbbbbbbbbbbbbbbbbbbbbbbbbbbbbbbbbbbbbbb"},"completeness":"complete","facts":[{"subject":"testguard:assessment","predicate":"has","object":"review","source":"AssertionRemoved"}],"diagnostics":[]}