{"apiVersion":"guard.partme.ai/v1alpha1","kind":"GuardFacts","analyzer":{"id":"codeguard.native-projection","version":"0.1.0"},"subject":{"id":"repo","snapshotDigest":"sha256:b15b6f75e5ec44aa81abd72063b2a533ec112e54c88857f6c521318eb9fd44f5"},"completeness":"partial","facts":[{"subject":"python","predicate":"has","object":"unused-import","source":"scope:ruff_f401_scope_incomplete"}],"diagnostics":["native file not complete","source suppression unsupported"]}