{"analyzer":{"id":"archguard.cargo.declarations","version":"0.1.0"},"apiVersion":"guard.partme.ai/v1alpha1","completeness":"complete","diagnostics":[],"facts":[{"object":"agent-contracts","predicate":"depends_on","source":"agent-job/Cargo.toml","subject":"agent-job"},{"object":"agent-saas","predicate":"depends_on","source":"agent-job/Cargo.toml","subject":"agent-job"}],"kind":"GuardFacts","subject":{"id":"cargo:sha256:28f0e746174acaad8499488dc5810022a0494c644e639a1ed0886c42d5d19b01","snapshotDigest":"sha256:22231782ae08badb7aa64e1e6283fe36bdd0eadda76c852ae4fa7f3a41cf590f"}}