{"apiVersion":"guard.partme.ai/v1alpha1","kind":"GuardFacts","analyzer":{"id":"testguard-local-evidence","version":"testguard.engine-map/v1"},"subject":{"id":"fixture:repo","snapshotDigest":"sha256:bbbbbbbbbbbbbbbbbbbbbbbbbbbbbbbbbbbbbbbbbbbbbbbbbbbbbbbbbbbbbbbb"},"completeness":"partial","facts":[{"subject":"testguard:assessment","predicate":"has","object":"unsatisfied","source":"{\"obligation_id\":\"O3\",\"test_id\":\"case3\",\"environment\":\"windows\"}"}],"diagnostics":["1 required test/environment scopes lack a finished execution"]}