{"apiVersion":"guard.partme.ai/v1alpha1","kind":"GuardFacts","analyzer":{"id":"codeguard.native-projection","version":"0.1.0"},"subject":{"id":"repo","snapshotDigest":"sha256:aaaaaaaaaaaaaaaaaaaaaaaaaaaaaaaaaaaaaaaaaaaaaaaaaaaaaaaaaaaaaaaa"},"completeness":"partial","facts":[{"subject":"code","predicate":"has","object":"gap","source":"native:f-1"},{"subject":"code","predicate":"has","object":"gap","source":"scope:native profile unqualified"}],"diagnostics":["native profile unqualified"]}